{
  "$schema": "https://json-schema.org/draft/2020-12/schema",
  "title": "FindingsPack",
  "type": "object",
  "required": ["findings"],
  "additionalProperties": false,
  "properties": {
    "schema_version": { "type": "string" },
    "findings": {
      "type": "array",
      "items": {
        "type": "object",
        "required": ["id", "text"],
        "additionalProperties": false,
        "properties": {
          "id": { "type": "string" },
          "text": { "type": "string" },
          "evidence": { "type": "string" },
          "confidence": { "type": "string" },
          "section_id": { "type": "string" },
          "section_title": { "type": "string" },
          "pages": {
            "type": "array",
            "description": "One-based physical PDF page indexes containing the finding's direct evidence.",
            "items": { "type": "integer", "minimum": 1 }
          }
        }
      }
    },
    "not_found_reason": { "type": "string" },
    "_cache": { "type": "object", "additionalProperties": true },
    "family_status": {
      "type": "object",
      "required": [
        "schema_version",
        "family",
        "source",
        "status",
        "confidence_score",
        "policy_action",
        "reason"
      ],
      "properties": {
        "schema_version": { "type": "string" },
        "family": { "type": "string" },
        "source": { "type": "string", "enum": ["evidence_pack"] },
        "status": { "type": "string", "enum": ["generated", "abstained"] },
        "confidence_score": { "type": "number" },
        "policy_action": {
          "type": "string",
          "enum": ["keep", "regenerate", "abstain"]
        },
        "reason": { "type": "string" }
      }
    }
  }
}
